Video URL,Title,Likes Count,Comment Count
https://www.youtube.com/watch?v=Y9PwynX3M2E,Sniper Roulette  Double The Live Double The Fun,393,16
https://www.youtube.com/watch?v=ewffZQ2GBrU,Witness the power of PHYSICS  Stormender Roulette,172,9
https://www.youtube.com/watch?v=DBzVeyACj3E,Sellout Roulette  spin fire will anyone save them,202,19
https://www.youtube.com/watch?v=G53t2FicZbc,Our BIGGEST Sniper Roulette Game,293,40
https://www.youtube.com/watch?v=tYPawohYb_k,Call of Duty Super Bowl Roulette Prediction 2024,252,19
https://www.youtube.com/watch?v=92NglppnU5s,Breacher Drone Roulette  MWIII,676,27
https://www.youtube.com/watch?v=_NKiYR75hLQ,New Shotgun Roulette we give the MX Guardian a spin,578,33
https://www.youtube.com/watch?v=632XHPSXYLg,Roulette in MW2  Dragons Breath Edition,693,34
https://www.youtube.com/watch?v=6nCnubKNtns,Chiefs vs Eagles  MW2 Sniper Roulette Superbowl Prediction 2023,480,60
https://www.youtube.com/watch?v=DGabCRZvQJM,Sniper Roulette in MW2  Double Snipers,745,37
https://www.youtube.com/watch?v=EixejJAEtEw,Throwing Knife Roulette in MW2  you asked here it is,878,76
https://www.youtube.com/watch?v=rHWxyhgXvEY,Revolver Roulette in MW2,785,60
https://www.youtube.com/watch?v=q8A1EBqAEcw,Shock Roulette in MW2  no one will ever play this with me again,1326,59
https://www.youtube.com/watch?v=LA4gXZPio0M,getting wet in sniper roulette  MW2,919,57
https://www.youtube.com/watch?v=kMF75BF3UbU,3rd Person MW2 Sniper Roulette  Extra Huge Bald Head Cam,1484,119
https://www.youtube.com/watch?v=fYwmvhyNBx8,Shotgun Roulette in MW2,4017,151
https://www.youtube.com/watch?v=_nr6cjBqBBE,Sniper Roulette Super Bowl LV Prediction Game in Cold War,594,39
https://www.youtube.com/watch?v=v-3MHXXt29A,Sniper Roulette in Cold War 24Players,700,47
https://www.youtube.com/watch?v=vNy9dEB8CG8,Shotgun Roulette with a SPECIAL PRIZE for the winner  Modern Warfare,642,52
https://www.youtube.com/watch?v=GocNBv-hyaA,Dragons Breath Roulette All Shotguns spit fire,863,89
https://www.youtube.com/watch?v=fg88PYcuQh8,Sniper Roulette in MW  SNIPE ONE GET ONE FREE,1774,98
https://www.youtube.com/watch?v=FM6wctmYzHU,Shotgun Roulette in Black Ops 3 BO3 has aged real nice,472,52
https://www.youtube.com/watch?v=9_rwhsG47KU,NEW Crossbow Roulette in Modern Warfare Explosive and Thermite rounds hahaha,625,33
https://www.youtube.com/watch?v=pXFbBzKNm4A,Sniper Roulette in Modern Warfare Prone Shots,619,92
https://www.youtube.com/watch?v=rrKTnFFjPtY,Shotgun Roulette TEAM REFLECTED DAMAGE EDITION Modern Warfare  Swiftor,692,34
https://www.youtube.com/watch?v=Qlal-cO1cRw,Shotgun Roulette in Black Ops 2  cant wait to do this in Modern Warfare,1031,90
https://www.youtube.com/watch?v=-WJxsDZ5FXc,Shotgun Roulette in Black Ops 4,1111,110
https://www.youtube.com/watch?v=xAEFCiNcCWY,Call of Duty Shotgun Roulette in Black Ops 2  Swiftor,952,72
https://www.youtube.com/watch?v=wtAzqqYzEFU,Our Shotgun Roulette Game Was Ruined In Black Ops 2  Swiftor,657,90
https://www.youtube.com/watch?v=lkCbbuOLsQA,Annihilator Roulette in Black Ops 4,1098,140
https://www.youtube.com/watch?v=tY6_XHAU0-o,A Very TENSE Sniper Roulette on Ice Breaker,853,60
https://www.youtube.com/watch?v=Qwo9NLnigwA,Try your best punk   Sniper Roulette on Summit,797,87
https://www.youtube.com/watch?v=QG0S6JLTClw,Axe Roulette in Black Ops 4,1489,132
https://www.youtube.com/watch?v=9rJfo_VyvhI,Revolver Roulette on Seatown  Swiftor,651,49
https://www.youtube.com/watch?v=EFblHzmxC_I,Does 3rd Person Sniper Roulette Work in MW2,426,23
https://www.youtube.com/watch?v=gVgaAgFdJIk,Sniper Roulette on Carrier  Swiftor,553,65
https://www.youtube.com/watch?v=LRgOhp51T1Q,Sniper Roulette on Aquarium  Swiftor,501,86
https://www.youtube.com/watch?v=5GU0fS3P-pU,Sniper in the middle on Havoc  Swiftor,710,100
https://www.youtube.com/watch?v=8nNkSekLP20,Seatown Roulette  Swiftor,1348,201
https://www.youtube.com/watch?v=O9keN7wcCRc,Sniper Roulette on EVAC   Swiftor,1055,183
https://www.youtube.com/watch?v=vBwOtvFKdQg,Shotgun Roulette Bounty Hunter Edition  Swiftor,1448,128
https://www.youtube.com/watch?v=cvvfLZvnkiM,Sniper Roulette on Havoc in BO3 Get hyped for the BO4 REVEAL  Swiftor,437,58
https://www.youtube.com/watch?v=HX9XknJnhME,Dunkirk Roulette  Shotguns  Two Windows  Swiftor,472,66
https://www.youtube.com/watch?v=WX3JNpBR_uo,Special Roulette Earning Crossbow Shots Black Ops 2  Swiftor,703,93
https://www.youtube.com/watch?v=Rsd2SZgBN-8,Redwood Snow Roulette in Black Ops 3  Swiftor,795,76
https://www.youtube.com/watch?v=TFuMpl1-w_k,A Very Rigged Sniper Roulette in COD WW2  Swiftor,770,104
https://www.youtube.com/watch?v=UmnWKId6gEM,Dodge Roulette Does moving really help  Swiftor,793,100
https://www.youtube.com/watch?v=xvgH89EcHas,Team Roulette in COD WW2  Swiftor,732,97
https://www.youtube.com/watch?v=IkcvIAOlMBk,Firing Squad Sniper Roulette on Ardennes Call of Duty WW2  Swiftor,628,71
https://www.youtube.com/watch?v=LuZCetcW6W0,1911 Roulette in COD WW2  Swiftor,3302,217
https://www.youtube.com/watch?v=sM455PJye8Y,Sniper Roulette in COD WW2  Swiftor,1289,169
https://www.youtube.com/watch?v=AdSnYSG-U5U,WW2 Shotgun Roulette on the Xbox One X  Swiftor,3573,415
https://www.youtube.com/watch?v=uY7v4ZTANqI,Sniper Roulette on HAVOC  Swiftor,508,61
https://www.youtube.com/watch?v=ZqrqsGpcTZA,Bald Man Angry About His Corpse  Swiftor,948,127
https://www.youtube.com/watch?v=hbu2xOlcn78,Sniper In Center Roulette  Swiftor,1088,84
https://www.youtube.com/watch?v=NmjTFCUnJnE,Sniper Roulette on AFTERMATH Whose getting a bullet  Swiftor,1224,162
https://www.youtube.com/watch?v=YbfgQK-FLeM,Sniper Roulette In The Center Bonus Too Close To The Edge  Swiftor,1057,120
https://www.youtube.com/watch?v=rQ6AfYS2e_U,Crossbow or Sniper Roulette  PLAYERS CHOOSE  Swiftor,1359,175
https://www.youtube.com/watch?v=POFjpUrohw0,MidDuel Reloads Kill in Sniper Roulette  Swiftor,1045,111
https://www.youtube.com/watch?v=wTkx_yYa_PM,Sniper Roulette on MELTDOWN Black Ops 2  Swiftor,1581,236
https://www.youtube.com/watch?v=BUTHax6gWMc,Dragon Fire Sniper Roulette  Swiftor,1216,144
https://www.youtube.com/watch?v=8kgxm8B4Y38,Quickie Shotgun Roulette  Swiftor,1007,116
https://www.youtube.com/watch?v=CGz6UmKwX3k,Sniper Roulette  360 No Scope RIP Host Shot  Swiftor,2006,91
https://www.youtube.com/watch?v=s0hHpS5qJs8,Shotgun Roulette on Carrier in Black Ops 2  Swiftor,2402,99
https://www.youtube.com/watch?v=R80xTzSuys0,SNIPER ROULETTE  Let The Good Times Spin  Swiftor,1019,57
https://www.youtube.com/watch?v=UFIlGcWRnfM,Ballistic Knife Roulette  Using the new BO3 Weapon  Swiftor,10415,372
https://www.youtube.com/watch?v=--7DpWJlaXE,Magnum Roulette in MWR  Swiftor,866,82
https://www.youtube.com/watch?v=9BVD9HzrUeM,Revolver Roulette on SEATOWN YEP aka Mortal Mode  Swiftor,3720,221
https://www.youtube.com/watch?v=WA_8p0votng,Sniper Roulette on NOIR Nore Nor NO R No arr  Swiftor,891,104
https://www.youtube.com/watch?v=eopSQyG3lUs,Explosive Crossbow Roulette  Swiftor,5179,255
https://www.youtube.com/watch?v=313X9nSA7i8,Patriots vs Falcons Prediction Game in Sniper Roulette UPDATE 100 Accurate  Swiftor,1968,631
https://www.youtube.com/watch?v=_TQAWY-mSAQ,Sniper Roulette on GRIND in Black Ops 2 DLC aka MORTAL MODE  Swiftor,3460,278
https://www.youtube.com/watch?v=EXmyIldPhz8,SHOTGUN ROULETTE ON COUNTDOWN aka Mortal Mode  Swiftor,2026,171
https://www.youtube.com/watch?v=v9dFk_eRq74,TEAM PISTOL ROULETTE  Spin and kill the OTHER team Please  Swiftor,1032,94
https://www.youtube.com/watch?v=0WptfcsY9w0,Sniper Roulette in COD4 Remastered MORTAL MODE  Swiftor,1103,116
https://www.youtube.com/watch?v=kiAMp923BPI,Sniper Roulette Remastered  GUESS WHO WINS  Swiftor,1650,195
https://www.youtube.com/watch?v=vH0BoqJFvgA,Sniper Roulette on Grounded in Infinite Warfare  DEATH PENALTY  Swiftor,1998,220
https://www.youtube.com/watch?v=CDAWjEvYiD0,REVERSE Sniper Roulette  KILL TO BE KILLED Call of Duty Black Ops 3  Swiftor,2534,196
https://www.youtube.com/watch?v=uFX616FT914,Sniper Roulette on Citadel  WARNING SHOT GONE WRONG Salvation DLC in Call of Duty Black Ops 3,2449,208
https://www.youtube.com/watch?v=x4B_y9zhhlo,INSANE Team Sniper Roulette With Reflected Friendly Fire THIS IS GOOD Mortal Mode  Swiftor,2570,180
https://www.youtube.com/watch?v=1MGwSLIsbYs,Sniper Roulette on Havoc  Dodging Shots Like Neo  Call of Duty Black Ops 3 Custom Gameplay,29952,1069
https://www.youtube.com/watch?v=u-pk1S9gbEs,Sniper I mean uh Shotgun Roulette on SPLASH Black Ops 3 Mortal Mode  Swiftor,4987,271
https://www.youtube.com/watch?v=XRDLhH9QzAo,Sniper Roulette Black Ops 3 Mortal Mode  Swiftor,3160,341
https://www.youtube.com/watch?v=3VkqhBQcrzU,Sniper Roulette In The Water  Mortal Mode Black Ops 3  Swiftor,5999,505
https://www.youtube.com/watch?v=97zYWbSbs4M,Mortal Mode AKA Sniper Roullette Black Ops 3  Swiftor,4147,337
https://www.youtube.com/watch?v=txCqxNPdfVA,Mortal Mode  Bringing Carnage Into The Circle  Swiftor,3504,254
https://www.youtube.com/watch?v=pZT-CFDMLcM,Rocket Launcher Mortal Mode Black Ops 3  Swiftor,3687,234
https://www.youtube.com/watch?v=OV_Ki5vrhKQ,Mortal Mode  Hearing Loss  Swiftor,3817,304
https://www.youtube.com/watch?v=QDAZTxOA9YI,A scenic peaceful game of Mortal Mode  Swiftor,3204,280
https://www.youtube.com/watch?v=AiuoCA4TvpY,Mortal Mode on Skyjacked  Swiftor,4840,588
https://www.youtube.com/watch?v=ebG5Pgt61LY,Mortal Mode  Finally Call of Duty Black Ops 3  Swiftor,5509,324
https://www.youtube.com/watch?v=lVADza0R3BY,Super Bowl Prediction Team Mortal Mode Broncos vs Panthers UPDATE NOPE  Swiftor,4068,998
https://www.youtube.com/watch?v=lh6tBQLtpVk,Mortal Mode on Splash Awakening DLC Black Ops 3  Swiftor,3584,383
https://www.youtube.com/watch?v=jyiFc-ChHWM,Mortal Mode on the Original Nuke Town  welcome home Black Ops 1  Swiftor,9875,549
https://www.youtube.com/watch?v=AZBdWTpC4g8,Mortal Mode Spin  Chill  Black Ops 3  Swiftor,2572,145
https://www.youtube.com/watch?v=zbGdXJ1k2t4,Mortal Mode on Black Ops 3  The very first What weapons next  Swiftor,2326,186
https://www.youtube.com/watch?v=-dUI2hIyH8I,Mortal Mode  Enter The Octosphere ok theres just 8 of us  Swiftor,2293,123
https://www.youtube.com/watch?v=YnN0lJ1NA6c,Mortal Mode  What an intense sandwich  Swiftor,2157,191
https://www.youtube.com/watch?v=qZrX10k-aPE,Mortal Mode  Looking Good  Swiftor,2859,156
https://www.youtube.com/watch?v=iTYf7OQch1k,Mortal Mode  Pew Pew Die  Swiftor,2450,278
https://www.youtube.com/watch?v=RUaZCyp_2aI,Swiftor Says Favela Forever,399,29
https://www.youtube.com/watch?v=ntzHsk8wDFg,Swiftor Says Guess Who  Full Episode,317,19
https://www.youtube.com/watch?v=p9yhWIqvGlI,Swiftor Says nice knowin ya,399,26
https://www.youtube.com/watch?v=h7EfcvNc_gM,Swiftor Says cool off,404,27
https://www.youtube.com/watch?v=jh4ZTzg85no,Swiftor Says Crime and Punishment,370,20
https://www.youtube.com/watch?v=jzmFLO6i0Xs,Swiftor Says time for Boot Camp,453,29
https://www.youtube.com/watch?v=sB9bvgv-_PA,Swiftor Says on NEW MAP Incline,323,29
https://www.youtube.com/watch?v=hYCFA8gq9cY,Swiftor Says Rizz Detection Unit,392,26
https://www.youtube.com/watch?v=On7mkp3C4x4,Swiftor Says Rust is your grave,383,16
https://www.youtube.com/watch?v=OAX8zgAgbJw,First Ever Swiftor Says in Fall Guys,443,47
https://www.youtube.com/watch?v=t3r894E6bNQ,Swiftor Says prepare to duel,349,29
https://www.youtube.com/watch?v=AL0WeVUxSH4,Swiftor Says Black Ops 6 Reveal Challenge  who paid attention,439,31
https://www.youtube.com/watch?v=MuTdAhGQ0HQ,Swiftor Says assemble,453,46
https://www.youtube.com/watch?v=66HWfrQGIu8,Swiftor Says vacation time,379,42
https://www.youtube.com/watch?v=C8vHZSTHd3M,The Quarry Challenges  Swiftor Says,375,29
https://www.youtube.com/watch?v=NHdfkXdnLGc,Only One Homelander Allowed  Swiftor Says,411,25
https://www.youtube.com/watch?v=ZY61kue7nDo,Did he say Swiftor Says,441,44
https://www.youtube.com/watch?v=Rk46i5u6uFM,Face Off  Swiftor Says on Shipment,311,17
https://www.youtube.com/watch?v=lfzHDizf9go,Sorry too many of you got deleted  Swiftor Says on Checkpoint,455,27
https://www.youtube.com/watch?v=qEeGFcdiqxc,Swiftor Says that escalated quickly,860,53
https://www.youtube.com/watch?v=30SCdBqVAIg,Swiftor Says before the fall,338,40
https://www.youtube.com/watch?v=oa4IQtwyFWY,Swiftor Says send in the clown,487,22
https://www.youtube.com/watch?v=zXk_JDt35YA,Swiftor Says a dangerous game,417,31
https://www.youtube.com/watch?v=QMmcsxdDYss,Swiftor Says Jealousy,395,16
https://www.youtube.com/watch?v=XJbgkEcQl2s,Swiftor Says the Dubai Challenge,465,28
https://www.youtube.com/watch?v=A8zppkW4jK0,Swiftor Says Good News  Bad News,334,12
https://www.youtube.com/watch?v=ZjHBPUB_DHU,Swiftor Says Just Doing My Job,443,40
https://www.youtube.com/watch?v=63tQgP4FmKk,Swiftor Says Tank You,404,18
https://www.youtube.com/watch?v=0J4s2uJ40RE,Swiftor Says rejection hurts,355,22
https://www.youtube.com/watch?v=5QSId5CS0xY,Swiftor Says this is only 6 minutes long uh oh,366,29
https://www.youtube.com/watch?v=T0f4AQ5c5bI,Swiftor Says NO SWIFTOR SAYS,632,28
https://www.youtube.com/watch?v=CVf0r1QrmGg,Swiftor Says knock knock,593,90
https://www.youtube.com/watch?v=8drJVdjIEdc,Swiftor Says Occupied,456,35
https://www.youtube.com/watch?v=jN-0w2NxdX8,Swiftor Says why did I leave my cam there,524,34
https://www.youtube.com/watch?v=I4_ZMaTWOKo,Swiftor Says hold,507,30
https://www.youtube.com/watch?v=py5QdG9FQKE,Swiftor Says it would be a shame if,404,32
https://www.youtube.com/watch?v=WNmLPZbR3f4,Swiftor Says MW3 38  Our Best Challenge Yet,862,50
https://www.youtube.com/watch?v=iU7MrG3Dpys,Swiftor Says ante up,536,34
https://www.youtube.com/watch?v=yH2BttOE7AY,Swiftor Says Pancake Delivery,808,81
https://www.youtube.com/watch?v=MEfDrVS_09A,Swiftor Says X marks the spot,559,27
https://www.youtube.com/watch?v=VAsPDPBO-NE,Swiftor Says judgement day,880,47
https://www.youtube.com/watch?v=EAqJo_MShIY,Swiftor Says he gave this one a terrible title my bad,533,30
https://www.youtube.com/watch?v=vWmiLtV5Tgg,Swiftor Says ones gotta go,706,21
https://www.youtube.com/watch?v=dmsTI9X6K4E,Swiftor Says be my valentine,628,35
https://www.youtube.com/watch?v=_s7nQecgGRQ,Swiftor Says escape the crate,522,26
https://www.youtube.com/watch?v=dTdextOY3YY,Swiftor Says down the chimney you go,461,34
https://www.youtube.com/watch?v=VaTVoe6TI40,Swiftor Says get to the point,662,61
https://www.youtube.com/watch?v=-3QLbRDrlQg,Swiftor Says clever and attractive title goes here,344,32
https://www.youtube.com/watch?v=x0REgCG3nOU,Says in MW2 Jan 2nd,350,31
https://www.youtube.com/watch?v=i10PFCRD6VU,Swiftor Says Yes Hes Done For,507,39
https://www.youtube.com/watch?v=RaMZHp52AXQ,Swiftor Says never volunteer,414,23
https://www.youtube.com/watch?v=3XM-InaRF_4,Milked for Content  Swiftor Says 37 in MW3,485,30
https://www.youtube.com/watch?v=WU0wbh8DHKg,Swiftor Says Grave Danger  36 in MW3,293,19
https://www.youtube.com/watch?v=iEjijolDxqs,Swiftor Says 35 in MW3  Hangar Time,307,23
https://www.youtube.com/watch?v=tQ-ZScMWJms,Swiftor Says 34  Count for me,350,19
https://www.youtube.com/watch?v=0R_JS8rx7Ts,Swiftor Says penetration test  MW3 33,423,37
https://www.youtube.com/watch?v=aRPdb8XXbTk,Will they fit  Swiftor Says 32 MW3,328,26
https://www.youtube.com/watch?v=rCWJKV_WYiU,Swiftor Says tension,5639,22
https://www.youtube.com/watch?v=Opm6l-Ndu1E,Swiftor Says 31 in MW3  Its A Sign,375,23
https://www.youtube.com/watch?v=oxd5O1W7qKo,Swiftor Says shattered glass,27505,135
https://www.youtube.com/watch?v=ei3R5l3e9MM,Swiftor Says bad Santa  30 in MW3,438,21
https://www.youtube.com/watch?v=vWHaCSmvJu4,Swiftor Says 29 in MW3  I hear ya like boats,352,32
https://www.youtube.com/watch?v=tV-fE3IMOAA,Swiftor Says 27 in MW3  Hip Fired,344,27
https://www.youtube.com/watch?v=kY1AhL4nE8Q,Swiftor Says 26 in MW3  Defeat The Meat,326,33
https://www.youtube.com/watch?v=aPhVLdJ0dhQ,Swiftor Says 23 in MW3  Just Plane Dangerous,560,60
https://www.youtube.com/watch?v=Q-KJSZ-WKqw,Swiftor Says 22 in MW3  this one is too much,736,68
https://www.youtube.com/watch?v=7RRdsJi25ZE,Swiftor Says 20 in MW3  Good Luck Buddy,916,54
https://www.youtube.com/watch?v=Lc6nMuOChnE,Swiftor Says 19 in MW3  Train Wrecked,754,64
https://www.youtube.com/watch?v=Y5eqOYmlHOM,Swiftor Says 18 in MW3  engraved,795,42
https://www.youtube.com/watch?v=xoU-CO_9uZ0,Swiftor Says 17 in MW3  Shadows of Highrise,734,53
https://www.youtube.com/watch?v=T8CWPaELsrw,Swiftor Says 15 in MW3  Against all odds,699,64
https://www.youtube.com/watch?v=Uk1KGAxIxI0,Swiftor Says 13 in MW3  Quarry,850,60
https://www.youtube.com/watch?v=d5mU-jfVhR8,Swiftor Says 11 in MW3,1091,74
https://www.youtube.com/watch?v=X-wjisBa6fM,Swiftor Says 8 in MW3  Rub A Dub Sub,871,56
https://www.youtube.com/watch?v=3XJj7DZyku4,Swiftor Says 6 Part 2 in MWIII  no ads,584,31
https://www.youtube.com/watch?v=xro2i8Fka7U,Swiftor Says 6 in MW3  PART 1 OF 2,685,28
https://www.youtube.com/watch?v=BSOlsNK02RE,Swiftor Says 5 in MWIII  Here we go Afghan,1284,64
https://www.youtube.com/watch?v=bOuJyiJPM7U,Swiftor Says MW3 2  Highrise  long falls,1672,57
https://www.youtube.com/watch?v=YANlh7QNVqI,Swiftor Says in MWIII 1  our first in MW3 2023 ,2830,134
https://www.youtube.com/watch?v=ddpcrd2Jzn8,Swiftor Says MW2 264  Audio Fixed,388,47
https://www.youtube.com/watch?v=bqCUiQnk6DY,Swiftor Says in MW2 262  Transfer Of Power,528,61
https://www.youtube.com/watch?v=7En88red0bI,Swiftor Says 260 in MW2,591,31
https://www.youtube.com/watch?v=9wzGwaopFRU,Swiftor Says in MW2 257  Gotta Believe,489,50
https://www.youtube.com/watch?v=AdleB3w3cOk,Swiftor Says in MW2 256  They Vented,912,57
https://www.youtube.com/watch?v=d8RqN9EY1l0,Swiftor Says in MW2 254,503,27
https://www.youtube.com/watch?v=e4nGK7LK50c,Swiftor Says in MW2 253  End of the MW2 Series is CLOSE,542,59
https://www.youtube.com/watch?v=VRw0G_Nv3yY,Swiftor Says 252 in MW2  Word of the Day Obliterated,529,35
https://www.youtube.com/watch?v=tlLvPD9EvGs,Swiftor Says 251 in MW2  Car Wars,599,73
https://www.youtube.com/watch?v=8awcNvMiINs,Not Swiftor Says  Teallen Says 3,392,48
https://www.youtube.com/watch?v=daq--c4N04g,Not Swiftor Says  Supanox Says,292,31
https://www.youtube.com/watch?v=Uj62jTxcelQ,Swiftor Says in MW2 249  The Great Wall,642,47
https://www.youtube.com/watch?v=YSIOBPOfQj0,Not Swiftor Says  Syrian Says 2,589,98
https://www.youtube.com/watch?v=mSpWg_WTytI,Swiftor Says in MW2 247  Spooky El Asilo,643,75
https://www.youtube.com/watch?v=MIsnT_tAvFg,Not Swiftor Says  Stoopid Says,459,44
https://www.youtube.com/watch?v=7ySujRmf9p8,Swiftor Says in MW2 246  You know what a short video means,642,43
https://www.youtube.com/watch?v=ifTluGR8JIA,Swiftor Says in MW2 244  Escape The Crabs,645,44
https://www.youtube.com/watch?v=7tb-O5ce-Gk,Swiftor Says in MW2  243,710,57
https://www.youtube.com/watch?v=JDbBtsVzOkU,Swiftor Says in MW2 242  Will the real Noir please stand up,997,57
https://www.youtube.com/watch?v=xor_4zxGSRA,Swiftor Says in MW2 238  Full Episode,597,32
https://www.youtube.com/watch?v=vFACgdEh9eQ,Swiftor Says 237 in MW2,745,46
